{
  "schema": "tarx-action-proposal.v1",
  "proposal_id": "prop_ent_deny_001",
  "created_at": "2026-07-29T20:12:00Z",
  "status": "proposed",
  "intent": "Sync restricted ontology objects while offline and without Foundry authority",
  "action": {
    "name": "enterprise.foundry.sync",
    "summary": "Attempt an enterprise ontology sync that policy forbids offline",
    "input": {
      "sensitivity": "restricted",
      "connectivity": "offline",
      "requires_foundry": true
    }
  },
  "grounding": {
    "target": "ontology://synthetic/restricted-objects",
    "observed_at": "2026-07-29T20:11:50Z",
    "confidence": 1
  },
  "risk": {
    "level": "blocked",
    "mutation": true,
    "external_side_effect": true,
    "requires_confirmation": true,
    "reasons": [
      "Policy conflict: restricted data cannot use Foundry while offline",
      "No silent remote fallback"
    ]
  },
  "route": {
    "runtime": "computer",
    "approved": false,
    "reason": "policy_deny:restricted_offline_foundry_conflict"
  }
}
