{
  "schema": "tarx-action-proposal.v1",
  "proposal_id": "prop_mcp_tool_001",
  "created_at": "2026-07-29T20:00:00Z",
  "status": "proposed",
  "intent": "Call an MCP tool that would create a remote issue after confirmation",
  "action": {
    "name": "mcp.github.create_issue",
    "summary": "Create a GitHub issue through the configured MCP server",
    "input": {
      "server": "github",
      "tool": "create_issue",
      "arguments": {
        "title": "Governed MCP mutation demo",
        "body": "Opened only after human approval under TARX contracts"
      }
    }
  },
  "grounding": {
    "target": "mcp:github/create_issue",
    "observed_at": "2026-07-29T19:59:55Z",
    "confidence": 0.97
  },
  "risk": {
    "level": "medium",
    "mutation": true,
    "external_side_effect": true,
    "requires_confirmation": true,
    "reasons": [
      "MCP tool has external side effects",
      "Creates visible repository state"
    ]
  },
  "route": {
    "runtime": "computer",
    "approved": true,
    "reason": "Computer plane hosts the MCP client; remote GitHub is the tool side effect"
  }
}
